{
  "schemaVersion": "sys-mb-owner-mapping/1",
  "classification": "RESTRICTED",
  "dataKind": "synthetic",
  "source": {
    "snapshotRef": "SYNTHETIC-SNAPSHOT",
    "snapshotSha256": "1111111111111111111111111111111111111111111111111111111111111111",
    "checkpointSha256": "2222222222222222222222222222222222222222222222222222222222222222",
    "capturedAt": "2026-09-12T00:00:00Z",
    "coverage": "PARTIAL"
  },
  "registry": {
    "organizations": [
      {
        "ref": "ORG-SYNTHETIC-A",
        "registryId": "900001",
        "evidenceRefs": [
          "EV-REGISTRY"
        ]
      }
    ],
    "businesses": [
      {
        "ref": "BUS-SYNTHETIC-A",
        "registryId": "900001",
        "organizationRef": "ORG-SYNTHETIC-A",
        "contextKey": "synthetic_a",
        "evidenceRefs": [
          "EV-REGISTRY"
        ]
      }
    ]
  },
  "evidence": [
    {
      "ref": "EV-REGISTRY",
      "kind": "registry_snapshot",
      "origin": "SYNTHETIC",
      "artifactRef": "SYNTHETIC-ARTIFACT-1",
      "sha256": "3333333333333333333333333333333333333333333333333333333333333333",
      "capturedAt": "2026-09-12T00:00:00Z"
    },
    {
      "ref": "EV-ROWS",
      "kind": "record_snapshot",
      "origin": "SYNTHETIC",
      "artifactRef": "SYNTHETIC-ARTIFACT-2",
      "sha256": "4444444444444444444444444444444444444444444444444444444444444444",
      "capturedAt": "2026-09-12T00:00:00Z"
    },
    {
      "ref": "EV-RELATIONS",
      "kind": "relation_observation",
      "origin": "SYNTHETIC",
      "artifactRef": "SYNTHETIC-ARTIFACT-3",
      "sha256": "5555555555555555555555555555555555555555555555555555555555555555",
      "capturedAt": "2026-09-12T00:00:00Z"
    }
  ],
  "decisions": [
    {
      "id": "OWN-01",
      "revision": 1,
      "status": "PENDING",
      "evidenceRefs": [],
      "attestation": null
    },
    {
      "id": "OWN-02",
      "revision": 1,
      "status": "PENDING",
      "evidenceRefs": [],
      "attestation": null
    },
    {
      "id": "OWN-03",
      "revision": 1,
      "status": "PENDING",
      "evidenceRefs": [],
      "attestation": null
    },
    {
      "id": "OWN-04",
      "revision": 1,
      "status": "PENDING",
      "evidenceRefs": [],
      "attestation": null
    },
    {
      "id": "OWN-05",
      "revision": 1,
      "status": "PENDING",
      "evidenceRefs": [],
      "attestation": null
    },
    {
      "id": "OWN-06",
      "revision": 1,
      "status": "PENDING",
      "evidenceRefs": [],
      "attestation": null
    },
    {
      "id": "OWN-07",
      "revision": 1,
      "status": "PENDING",
      "evidenceRefs": [],
      "attestation": null
    },
    {
      "id": "OWN-08",
      "revision": 1,
      "status": "PENDING",
      "evidenceRefs": [],
      "attestation": null
    }
  ],
  "referenceRecords": [
    {
      "ref": "REF-SYNTHETIC-PRODUCT",
      "table": "products",
      "key": {
        "id": "synthetic-product-a"
      },
      "rowSha256": "6666666666666666666666666666666666666666666666666666666666666666",
      "owner": {
        "organizationRef": "ORG-SYNTHETIC-A",
        "businessRef": "BUS-SYNTHETIC-A"
      },
      "evidenceRefs": [
        "EV-ROWS"
      ]
    }
  ],
  "entities": [
    {
      "ref": "MAP-CATALOG",
      "table": "catalog_definitions",
      "key": {
        "id": "synthetic-catalog-a"
      },
      "rowSha256": "7777777777777777777777777777777777777777777777777777777777777777",
      "status": "PENDING",
      "classification": "UNKNOWN",
      "disposition": "QUARANTINE",
      "owner": null,
      "reasonCode": "UNKNOWN_OWNER",
      "relationCoverage": "PARTIAL",
      "relations": [],
      "decisionRefs": [
        "OWN-01",
        "OWN-03",
        "OWN-08",
        "OWN-02",
        "OWN-04"
      ],
      "evidenceRefs": [
        "EV-ROWS"
      ],
      "attestation": null
    },
    {
      "ref": "MAP-SUBCATEGORY",
      "table": "catalog_subcategories",
      "key": {
        "id": "900011"
      },
      "rowSha256": "7777777777777777777777777777777777777777777777777777777777777777",
      "status": "PENDING",
      "classification": "UNKNOWN",
      "disposition": "QUARANTINE",
      "owner": null,
      "reasonCode": "UNKNOWN_OWNER",
      "relationCoverage": "PARTIAL",
      "relations": [
        {
          "field": "catalog_id",
          "state": "LINKED",
          "targetRef": "MAP-CATALOG",
          "evidenceRefs": [
            "EV-RELATIONS"
          ]
        }
      ],
      "decisionRefs": [
        "OWN-01",
        "OWN-03",
        "OWN-08"
      ],
      "evidenceRefs": [
        "EV-ROWS"
      ],
      "attestation": null
    },
    {
      "ref": "MAP-ITEM",
      "table": "catalog_items",
      "key": {
        "id": "900012"
      },
      "rowSha256": "7777777777777777777777777777777777777777777777777777777777777777",
      "status": "PENDING",
      "classification": "UNKNOWN",
      "disposition": "QUARANTINE",
      "owner": null,
      "reasonCode": "UNKNOWN_OWNER",
      "relationCoverage": "PARTIAL",
      "relations": [
        {
          "field": "catalog_id",
          "state": "LINKED",
          "targetRef": "MAP-CATALOG",
          "evidenceRefs": [
            "EV-RELATIONS"
          ]
        }
      ],
      "decisionRefs": [
        "OWN-01",
        "OWN-03",
        "OWN-08"
      ],
      "evidenceRefs": [
        "EV-ROWS"
      ],
      "attestation": null
    },
    {
      "ref": "MAP-SETTINGS",
      "table": "catalog_settings",
      "key": {
        "catalog_id": "synthetic-catalog-a"
      },
      "rowSha256": "7777777777777777777777777777777777777777777777777777777777777777",
      "status": "PENDING",
      "classification": "UNKNOWN",
      "disposition": "QUARANTINE",
      "owner": null,
      "reasonCode": "UNKNOWN_OWNER",
      "relationCoverage": "PARTIAL",
      "relations": [
        {
          "field": "catalog_id",
          "state": "LINKED",
          "targetRef": "MAP-CATALOG",
          "evidenceRefs": [
            "EV-RELATIONS"
          ]
        }
      ],
      "decisionRefs": [
        "OWN-01",
        "OWN-03",
        "OWN-08"
      ],
      "evidenceRefs": [
        "EV-ROWS"
      ],
      "attestation": null
    },
    {
      "ref": "MAP-PAGE",
      "table": "catalog_pages",
      "key": {
        "id": "900013"
      },
      "rowSha256": "7777777777777777777777777777777777777777777777777777777777777777",
      "status": "PENDING",
      "classification": "UNKNOWN",
      "disposition": "QUARANTINE",
      "owner": null,
      "reasonCode": "UNKNOWN_OWNER",
      "relationCoverage": "PARTIAL",
      "relations": [
        {
          "field": "catalog_id",
          "state": "LINKED",
          "targetRef": "MAP-CATALOG",
          "evidenceRefs": [
            "EV-RELATIONS"
          ]
        },
        {
          "field": "embedded_item_reference",
          "state": "LINKED",
          "targetRef": "MAP-ITEM",
          "evidenceRefs": [
            "EV-RELATIONS"
          ]
        }
      ],
      "decisionRefs": [
        "OWN-01",
        "OWN-03",
        "OWN-08"
      ],
      "evidenceRefs": [
        "EV-ROWS"
      ],
      "attestation": null
    },
    {
      "ref": "MAP-HISTORY",
      "table": "catalog_page_history",
      "key": {
        "id": "900014"
      },
      "rowSha256": "7777777777777777777777777777777777777777777777777777777777777777",
      "status": "PENDING",
      "classification": "UNKNOWN",
      "disposition": "QUARANTINE",
      "owner": null,
      "reasonCode": "UNKNOWN_OWNER",
      "relationCoverage": "PARTIAL",
      "relations": [
        {
          "field": "catalog_page_id",
          "state": "LINKED",
          "targetRef": "MAP-PAGE",
          "evidenceRefs": [
            "EV-RELATIONS"
          ]
        }
      ],
      "decisionRefs": [
        "OWN-01",
        "OWN-03",
        "OWN-08"
      ],
      "evidenceRefs": [
        "EV-ROWS"
      ],
      "attestation": null
    },
    {
      "ref": "MAP-AUTOMATION",
      "table": "catalog_automations",
      "key": {
        "id": "900015"
      },
      "rowSha256": "7777777777777777777777777777777777777777777777777777777777777777",
      "status": "PENDING",
      "classification": "UNKNOWN",
      "disposition": "QUARANTINE",
      "owner": null,
      "reasonCode": "UNKNOWN_OWNER",
      "relationCoverage": "PARTIAL",
      "relations": [
        {
          "field": "catalog_id",
          "state": "LINKED",
          "targetRef": "MAP-CATALOG",
          "evidenceRefs": [
            "EV-RELATIONS"
          ]
        }
      ],
      "decisionRefs": [
        "OWN-01",
        "OWN-03",
        "OWN-08",
        "OWN-06"
      ],
      "evidenceRefs": [
        "EV-ROWS"
      ],
      "attestation": null
    },
    {
      "ref": "MAP-TREND",
      "table": "trend_proposals",
      "key": {
        "id": "900016"
      },
      "rowSha256": "7777777777777777777777777777777777777777777777777777777777777777",
      "status": "PENDING",
      "classification": "UNKNOWN",
      "disposition": "QUARANTINE",
      "owner": null,
      "reasonCode": "UNKNOWN_OWNER",
      "relationCoverage": "PARTIAL",
      "relations": [
        {
          "field": "catalog_id",
          "state": "LINKED",
          "targetRef": "MAP-CATALOG",
          "evidenceRefs": [
            "EV-RELATIONS"
          ]
        },
        {
          "field": "generated_item_id",
          "state": "LINKED",
          "targetRef": "MAP-ITEM",
          "evidenceRefs": [
            "EV-RELATIONS"
          ]
        }
      ],
      "decisionRefs": [
        "OWN-01",
        "OWN-03",
        "OWN-08"
      ],
      "evidenceRefs": [
        "EV-ROWS"
      ],
      "attestation": null
    },
    {
      "ref": "MAP-BLOB",
      "table": "catalog_image_blobs",
      "key": {
        "filename": "synthetic-asset.png"
      },